[
  {
    "retention_permanent_archive_terminal_authority_notice_record_id": "retention-permanent-archive-terminal-authority-notice-basic-restore-001",
    "permanent_archive_terminal_authority_notice_kind": "retention_permanent_archive_terminal_authority_notice",
    "created_time": "2026-01-01T00:10:39Z",
    "node_id": "formal-rollup-node-example",
    "retention_permanent_archive_terminal_governance_attestation_closeout_record_id": "retention-permanent-archive-terminal-governance-attestation-closeout-basic-restore-001",
    "retention_permanent_archive_terminal_governance_attestation_verification_receipt_id": "retention-permanent-archive-terminal-governance-attestation-verification-basic-restore-001",
    "permanent_archive_terminal_authority_notice_state": "published",
    "permanent_archive_terminal_authority_notice_scope": "closed_retention_permanent_archive_terminal_governance_attestation",
    "permanent_archive_terminal_authority_notice_refs": [
      "retention-permanent-archive-terminal-governance-attestation-closeout-basic-restore-001",
      "retention-permanent-archive-terminal-governance-attestation-verification-basic-restore-001",
      "retention-permanent-archive-terminal-governance-attestation-basic-restore-001",
      "retention/retention-policy.json"
    ],
    "subject_refs": [
      "retention-permanent-archive-terminal-health-snapshot-closeout-basic-restore-001",
      "retention-permanent-archive-terminal-health-snapshot-verification-basic-restore-001",
      "retention-permanent-archive-terminal-health-snapshot-basic-restore-001"
    ],
    "basis_refs": [
      "retention-permanent-archive-terminal-governance-attestation-closeout-basic-restore-001",
      "retention-permanent-archive-terminal-governance-attestation-verification-basic-restore-001",
      "retention/retention-policy.json"
    ],
    "digest_algorithm": "sha256-sorted-retention-permanent-archive-terminal-authority-notice-ref-list",
    "permanent_archive_terminal_authority_notice_ref_digest": "c77d1425daa5dcebf934e08a16fe53af54d485a7defb01fe6d24e789868e94a3",
    "permanent_archive_terminal_authority_notice_by_ref": "tools/pfem_retention_permanent_archive_terminal_authority_notice_records.py",
    "summary": "Synthetic example retention permanent archive terminal authority notice record built from the closed retention permanent archive terminal governance attestation path."
  }
]
